{
	"$schema": "./colors.schema.json",
	"metadata": {
		"version": "1.2.0",
		"note": "The semantic colour layer. The fixed palette lives in styles/palette.css; this file maps semantic roles to palette entries and generated CSS variables."
	},
	"scale": {
		"subtle": 10,
		"wash": 12,
		"soft": 20,
		"muted": 40,
		"strong": 60
	},
	"roles": {
		"text-default": {
			"from": "text"
		},
		"text-muted": {
			"from": "muted"
		},
		"text-subtle": {
			"from": "hint"
		},
		"text-disabled": {
			"from": "text",
			"alpha": "strong",
			"note": "disabled non-control text = the default text colour at the `strong` (60%) alpha step — a disabled element inherits its enabled semantic colour, dimmed at the token level, never a dedicated disabled palette value"
		},
		"text-on-primary": {
			"from": "onAccent"
		},
		"text-on-danger": {
			"from": "onDanger"
		},
		"text-link": {
			"from": "info",
			"note": "global.css `a {}` is the only consumer; no component styles a bare link"
		},
		"container-project-bg": {
			"from": "background",
			"note": "the focused session surface shared by chat, read-only previews, and project context"
		},
		"container-sidebar-bg": {
			"from": "sidebar"
		},
		"container-header-bg": {
			"from": "header"
		},
		"container-content-bg": {
			"from": "content",
			"note": "the recessed read-only code and diff canvas used by Shiki previews and changed-file inspection"
		},
		"container-elevated-bg": {
			"from": "elevated",
			"note": "every raised surface: dialogs, popovers, menus, toasts, cards, code blocks"
		},
		"control-bg": {
			"from": "input"
		},
		"control-bg-hovered": {
			"from": "hover"
		},
		"control-bg-selected": {
			"from": "hover"
		},
		"control-primary-bg": {
			"from": "accentSolid",
			"note": "the SOLID primary button fill — its own palette source (`accentSolid`), decoupled from `accent` so a theme can brighten the opaque fill without moving the alpha-derived primary tints (primary-subtle/soft/muted) or the accent used for text/ring/border; every theme maps accentSolid to its accent except regular Light, which uses the brighter dark-theme green"
		},
		"control-primary-bg-hovered": {
			"from": "accentHover",
			"note": "the primary button's hover fill — its own manifest key so a theme owns the hover step instead of the button fading with an opacity utility"
		},
		"control-primary-text": {
			"from": "onAccent"
		},
		"control-border-default": {
			"from": "border"
		},
		"control-border-active": {
			"from": "borderStrong"
		},
		"control-disabled-bg": {
			"from": "input",
			"alpha": "strong",
			"note": "disabled control fill = the default control fill (`input`, i.e. control-bg) at the `strong` (60%) alpha step"
		},
		"control-disabled-text": {
			"from": "text",
			"alpha": "strong",
			"note": "disabled control label/icon = the default control text colour (`text`, i.e. text-default) at the `strong` (60%) alpha step"
		},
		"control-disabled-border": {
			"from": "border",
			"alpha": "strong",
			"note": "disabled control border = the default control border (`border`, i.e. control-border-default) at the `strong` (60%) alpha step"
		},
		"control-primary-disabled-bg": {
			"from": "accent",
			"alpha": "strong",
			"note": "disabled primary button fill = the accent hue at the `strong` (60%) alpha step — kept on `accent` (the alpha-tint base), not the brightened solid `accentSolid`, so the disabled fill stays with the primary tint family"
		},
		"control-primary-disabled-text": {
			"from": "onAccent",
			"alpha": "strong",
			"note": "disabled primary button label/icon = the normal primary text (`onAccent`, i.e. control-primary-text) at the `strong` (60%) alpha step"
		},
		"border-default": {
			"from": "borderStrong"
		},
		"border-muted": {
			"from": "border"
		},
		"primary": {
			"from": "accent"
		},
		"primary-subtle": {
			"from": "accent",
			"alpha": "subtle"
		},
		"primary-soft": {
			"from": "accent",
			"alpha": "soft"
		},
		"primary-muted": {
			"from": "accent",
			"alpha": "muted"
		},
		"on-primary-soft": {
			"from": "onAccent",
			"alpha": "soft"
		},
		"feedback-info": {
			"from": "info"
		},
		"feedback-info-subtle": {
			"from": "info",
			"alpha": "wash"
		},
		"feedback-success": {
			"from": "success"
		},
		"feedback-success-subtle": {
			"from": "success",
			"alpha": "wash"
		},
		"feedback-success-muted": {
			"from": "success",
			"alpha": "muted"
		},
		"feedback-error": {
			"from": "danger"
		},
		"feedback-error-subtle": {
			"from": "danger",
			"alpha": "wash"
		},
		"feedback-error-muted": {
			"from": "danger",
			"alpha": "muted"
		},
		"feedback-warning": {
			"from": "warning"
		},
		"feedback-warning-subtle": {
			"from": "warning",
			"alpha": "wash"
		},
		"bubble-user-bg": {
			"from": "bubbleAccent",
			"alpha": "subtle"
		},
		"bubble-user-border": {
			"from": "bubbleAccent",
			"alpha": "muted"
		},
		"selection-text": {
			"from": "selectionForeground",
			"fallback": "inherit",
			"note": "nullable in the manifest (high contrast keeps the native foreground)"
		},
		"selection-bg": {
			"from": "selection",
			"note": "native ::selection in global.css; not a utility"
		},
		"editor-selection-bg": {
			"from": "editorSelection"
		},
		"editor-selection-text": {
			"from": "editorSelectionForeground",
			"note": "read directly by Shiki and selection CSS; a utility would be dead weight"
		}
	},
	"effects": {
		"sunken": {
			"note": "a recessed row or track",
			"dark": "rgba(0, 0, 0, 0.12)",
			"light": "rgba(0, 0, 0, 0.05)"
		},
		"overlay": {
			"note": "the scrim behind a modal",
			"dark": "rgba(0, 0, 0, 0.5)",
			"light": "rgba(0, 0, 0, 0.5)"
		},
		"shadow-sm": {
			"dark": "0 2px 8px rgba(0, 0, 0, 0.3)",
			"light": "0 2px 8px rgba(0, 0, 0, 0.1)"
		},
		"shadow-md": {
			"dark": "0 4px 16px rgba(0, 0, 0, 0.35)",
			"light": "0 4px 16px rgba(0, 0, 0, 0.12)"
		},
		"shadow-lg": {
			"dark": "0 8px 28px rgba(0, 0, 0, 0.4)",
			"light": "0 8px 28px rgba(0, 0, 0, 0.14)"
		}
	}
}
